{
  "schema_version": "formalization-faithfulness-1",
  "role": "batch-source-contract",
  "source_group": "vershynin-hdp-chapter02-proposition-2-1-2",
  "source_sha256": "ecc53be86c091b5df118c4464b6d81672e0261df960a3f32ceea4900107d090a",
  "source_locator_sha256": "e8bee2f1fe6c72518ac6b08c9934fba167fb8de1f0dbb5030ee8af8d5f1e1a7a",
  "task_ids": [
    "HDP-02-PROP-2.1.2"
  ],
  "contracts": [
    {
      "task_id": "HDP-02-PROP-2.1.2",
      "source_evidence": [
        {
          "location": "PDF page 2; printed page 13",
          "anchor": "Proposition 2.1.2, main statement",
          "observation": "For a standard normal random variable g and every real t>0, the source gives the two-sided estimate (1/t-1/t^3)(1/sqrt(2π))exp(-t^2/2) ≤ P{g≥t} ≤ (1/t)(1/sqrt(2π))exp(-t^2/2)."
        },
        {
          "location": "PDF page 2; printed page 13",
          "anchor": "Proposition 2.1.2 proof, upper-bound calculation",
          "observation": "The proof writes P{g≥t}=(1/sqrt(2π))∫_t^∞exp(-x^2/2)dx, substitutes x=t+y, bounds exp(-y^2/2) by 1, and evaluates ∫_0^∞exp(-ty)dy=1/t."
        },
        {
          "location": "PDF page 2; printed page 13",
          "anchor": "Proposition 2.1.2 proof, lower-bound identity",
          "observation": "The lower bound is obtained from the exact identity ∫_t^∞(1-3x^-4)exp(-x^2/2)dx=(1/t-1/t^3)exp(-t^2/2)."
        }
      ],
      "statement": {
        "binders": [
          "g is a real-valued standard normal random variable with distribution N(0,1) on an implicit probability space (PDF page 2/printed page 13, Proposition 2.1.2 opening sentence).",
          "t is a real threshold universally quantified over t>0 (PDF page 2/printed page 13, Proposition 2.1.2 main statement)."
        ],
        "hypotheses": [
          "g has the standard normal distribution N(0,1) (PDF page 2/printed page 13, Proposition 2.1.2 opening sentence).",
          "t>0 (PDF page 2/printed page 13, Proposition 2.1.2 main statement)."
        ],
        "conclusions": [
          "(1/t-1/t^3)(1/sqrt(2π))exp(-t^2/2) ≤ P{g≥t} for every t>0 (PDF page 2/printed page 13, Proposition 2.1.2 main display).",
          "P{g≥t} ≤ (1/t)(1/sqrt(2π))exp(-t^2/2) for every t>0 (PDF page 2/printed page 13, Proposition 2.1.2 main display)."
        ],
        "definitions_and_conventions": [
          "N(0,1) denotes the standard normal distribution (PDF page 2/printed page 13, Proposition 2.1.2 opening sentence).",
          "P{g≥t} is the one-sided non-strict upper-tail probability (PDF page 2/printed page 13, Proposition 2.1.2 main display).",
          "The standard normal density is (1/sqrt(2π))exp(-x^2/2), as used in the tail-integral formula in the proof (PDF page 2/printed page 13, Proposition 2.1.2 proof).",
          "The factors 1/t-1/t^3 and 1/t multiply the full density value (1/sqrt(2π))exp(-t^2/2) (PDF page 2/printed page 13, Proposition 2.1.2 main display)."
        ],
        "implicit_context": [
          "The proposition concerns only the upper tail g≥t, not the two-sided tail |g|≥t (PDF page 2/printed page 13, Proposition 2.1.2 main display).",
          "The bounds are exact inequalities valid for every t>0, not asymptotic approximations (PDF page 2/printed page 13, Proposition 2.1.2 main statement).",
          "For 0<t<1 the lower prefactor 1/t-1/t^3 is negative, but the proposition still states the lower bound throughout the full t>0 domain (PDF page 2/printed page 13, Proposition 2.1.2 main statement).",
          "The neighboring 'In particular' display labeled Equation (2.3) is a separate corollary and is excluded from this task's conclusions (PDF page 2/printed page 13, text immediately following the main Proposition 2.1.2 display)."
        ],
        "semantic_facets": [
          {
            "topic": "tail sidedness and threshold domain",
            "details": [
              "The event is g≥t with a non-strict inequality (PDF page 2/printed page 13, Proposition 2.1.2 main display).",
              "The main two-sided estimate is universally quantified over strictly positive t (PDF page 2/printed page 13, Proposition 2.1.2 main statement)."
            ]
          },
          {
            "topic": "exact prefactors",
            "details": [
              "The lower prefactor is exactly 1/t-1/t^3, not 1/t alone or an unspecified constant multiple (PDF page 2/printed page 13, Proposition 2.1.2 main display).",
              "The upper prefactor is exactly 1/t, and both bounds contain the same factor (1/sqrt(2π))exp(-t^2/2) (PDF page 2/printed page 13, Proposition 2.1.2 main display)."
            ]
          },
          {
            "topic": "proof identities",
            "details": [
              "The upper estimate is derived from the exact standard-normal tail integral and the change of variables x=t+y (PDF page 2/printed page 13, Proposition 2.1.2 proof).",
              "The lower estimate uses the exact integral identity with multiplier 1-3x^-4 (PDF page 2/printed page 13, final paragraph of the proof)."
            ]
          }
        ]
      },
      "undebatable_constraints": [
        "The random variable g has distribution N(0,1) (PDF page 2/printed page 13, Proposition 2.1.2).",
        "The estimate is quantified for every t>0 (PDF page 2/printed page 13, Proposition 2.1.2).",
        "The event is the one-sided non-strict event {g≥t} (PDF page 2/printed page 13, Proposition 2.1.2 main display).",
        "The lower bound is exactly (1/t-1/t^3)(1/sqrt(2π))exp(-t^2/2) (PDF page 2/printed page 13, Proposition 2.1.2 main display).",
        "The upper bound is exactly (1/t)(1/sqrt(2π))exp(-t^2/2) (PDF page 2/printed page 13, Proposition 2.1.2 main display).",
        "Both relations are non-strict inequalities (PDF page 2/printed page 13, Proposition 2.1.2 main display).",
        "The lower bound remains stated for 0<t<1 even though its prefactor is negative there (PDF page 2/printed page 13, Proposition 2.1.2 main statement).",
        "No absolute value around g, lower-tail event, factor 2, unspecified constant, or asymptotic qualifier belongs to the main proposition display (PDF page 2/printed page 13, Proposition 2.1.2)."
      ],
      "ambiguities": [],
      "contract_plain_english": "If g is standard normal, then for every t>0 its one-sided upper-tail probability lies between the standard-normal density at t multiplied by 1/t-1/t^3 and the same density multiplied by 1/t. These are exact bounds with the displayed constants (PDF page 2/printed page 13, main display of Proposition 2.1.2)."
    }
  ]
}
